{
  "schema_version": "1.1",
  "generated_from": "config/ppt_asset_roots.json",
  "generated_from_details": {
    "local_roots": "config/ppt_asset_roots.json",
    "theme_configs": [
      "config/pptx_theme.example.json",
      "config/pptx_theme.neutral_modern.json"
    ],
    "chart_presets": [
      "chart_preset.simple_bar_chart"
    ],
    "image_policies": [
      "image_policy.user_supplied_or_generated"
    ],
    "external_registry": {
      "enabled": true,
      "workspace_ref": "sibling:assets achivement for work",
      "source": "downloaded-assets/registry/recommended-assets.json",
      "public_contribution_gate": "https://github.com/Kdreammaker/ai-asset-contribution-gate",
      "private_reference_analysis_required": true,
      "records": 48,
      "policy": "registry-first; active recommended records only; no external mutation"
    }
  },
  "selection_policy": {
    "raw_folders_are_not_source_of_truth": true,
    "external_assets_are_registry_references_only": true,
    "do_not_hard_code_external_absolute_paths": true,
    "brand_assets_require_explicit_request": true,
    "public_asset_contribution_gate": "https://github.com/Kdreammaker/ai-asset-contribution-gate",
    "public_gate_usage": "candidate intake and safety review only",
    "private_reference_analysis_required": true,
    "private_assetization_required": true,
    "private_registry_activation_required": true,
    "workspace_asset_transfer": {
      "allowed_by_default": false,
      "requires_manifest": true,
      "requires_explicit_approval": true,
      "public_exposure_allowed": false,
      "forbidden_public_payloads": [
        "private references",
        "binary assets",
        "registry exports",
        "local absolute paths",
        "Drive linkage",
        "work logs"
      ]
    }
  },
  "assets": [
    {
      "asset_id": "chart_preset.simple_bar_chart",
      "asset_class": "chart_preset",
      "source_type": "local_code",
      "source_path": "system/pptx_system.py",
      "license": "internal-code",
      "license_action": "none",
      "risk_level": "low",
      "production_eligible": true,
      "allowed_for_ppt": true,
      "style_tags": [
        "chart",
        "bar",
        "data_visualization"
      ],
      "recommended_use": "basic bar-chart slot rendering",
      "kind": "chart_preset",
      "preset_name": "simple_bar_chart"
    },
    {
      "asset_id": "external.blog_webpage_visuals.uxwing.article_icon_svg",
      "asset_class": "icon",
      "source_type": "external_registry_reference",
      "source_path": null,
      "license": "free-with-restrictions",
      "license_action": "check-source-policy",
      "risk_level": "medium",
      "production_eligible": true,
      "allowed_for_ppt": true,
      "style_tags": [
        "external_registry",
        "blog_webpage_visuals",
        "icon",
        "uxwing"
      ],
      "recommended_use": "external registry reference for future PPT materialization",
      "kind": "icon_svg",
      "external_asset_uid": "sha256:8a69a7445c090017080e9f1aea65dc450894a0ea676bed6f3e93137a9898b76c:953ea6d341b1",
      "external_set_id": "blog-webpage-visuals",
      "external_source_name": "UXWing",
      "external_asset_name": "article-icon.svg",
      "external_relative_path": "icons\\uxwing-selected\\article-icon.svg",
      "policy_notes": {
        "status": "active",
        "brand_guidelines_required": false,
        "attribution_required": false,
        "notes_for_ai": "Use as visual material for documents, reports, decks, blogs, and webpages. Do not treat as a redistributable open-source icon package. Additional selected SVG from saved public UXWing image sitemaps; matched terms: article;content;seo. Required action: check-source-policy."
      }
    },
    {
      "asset_id": "external.blog_webpage_visuals.uxwing.blogger_website_icon_svg",
      "asset_class": "icon",
      "source_type": "external_registry_reference",
      "source_path": null,
      "license": "free-with-restrictions",
      "license_action": "check-source-policy",
      "risk_level": "medium",
      "production_eligible": true,
      "allowed_for_ppt": true,
      "style_tags": [
        "external_registry",
        "blog_webpage_visuals",
        "icon",
        "uxwing"
      ],
      "recommended_use": "external registry reference for future PPT materialization",
      "kind": "icon_svg",
      "external_asset_uid": "sha256:4918096f4460b25c8687d48d7454ce81821905bb1c3789d1d65b9095c59d08a9:a09ca57efef4",
      "external_set_id": "blog-webpage-visuals",
      "external_source_name": "UXWing",
      "external_asset_name": "blogger-website-icon.svg",
      "external_relative_path": "icons\\uxwing-selected\\blogger-website-icon.svg",
      "policy_notes": {
        "status": "active",
        "brand_guidelines_required": false,
        "attribution_required": false,
        "notes_for_ai": "Use as visual material for documents, reports, decks, blogs, and webpages. Do not treat as a redistributable open-source icon package. Additional selected SVG from saved public UXWing image sitemaps; matched terms: blog;content;web;website. Required action: check-source-policy."
      }
    },
    {
      "asset_id": "external.blog_webpage_visuals.uxwing.business_presentation_icon_svg",
      "asset_class": "icon",
      "source_type": "external_registry_reference",
      "source_path": null,
      "license": "free-with-restrictions",
      "license_action": "check-source-policy",
      "risk_level": "medium",
      "production_eligible": true,
      "allowed_for_ppt": true,
      "style_tags": [
        "external_registry",
        "blog_webpage_visuals",
        "icon",
        "uxwing"
      ],
      "recommended_use": "external registry reference for future PPT materialization",
      "kind": "icon_svg",
      "external_asset_uid": "sha256:06b80a7a7c8c36d5adefc2f9685fa3f12dc0350f3cf986c9af327dce9057374b:a61ae259d0b7",
      "external_set_id": "blog-webpage-visuals",
      "external_source_name": "UXWing",
      "external_asset_name": "business-presentation-icon.svg",
      "external_relative_path": "icons\\uxwing-selected\\business-presentation-icon.svg",
      "policy_notes": {
        "status": "active",
        "brand_guidelines_required": false,
        "attribution_required": false,
        "notes_for_ai": "Use as visual material for documents, reports, decks, blogs, and webpages. Do not treat as a redistributable open-source icon package. Selected from public UXWing image sitemaps by approved keywords; robots/license snapshots saved. Required action: check-source-policy."
      }
    },
    {
      "asset_id": "external.blog_webpage_visuals.uxwing.computer_report_icon_svg",
      "asset_class": "icon",
      "source_type": "external_registry_reference",
      "source_path": null,
      "license": "free-with-restrictions",
      "license_action": "check-source-policy",
      "risk_level": "medium",
      "production_eligible": true,
      "allowed_for_ppt": true,
      "style_tags": [
        "external_registry",
        "blog_webpage_visuals",
        "icon",
        "uxwing"
      ],
      "recommended_use": "external registry reference for future PPT materialization",
      "kind": "icon_svg",
      "external_asset_uid": "sha256:33751a8e4079c8e5afffb0d9c133a1193baeda122fe30b62b3593f3ae937c661:a798200773ef",
      "external_set_id": "blog-webpage-visuals",
      "external_source_name": "UXWing",
      "external_asset_name": "computer-report-icon.svg",
      "external_relative_path": "icons\\uxwing-selected\\computer-report-icon.svg",
      "policy_notes": {
        "status": "active",
        "brand_guidelines_required": false,
        "attribution_required": false,
        "notes_for_ai": "Use as visual material for documents, reports, decks, blogs, and webpages. Do not treat as a redistributable open-source icon package. Selected from public UXWing image sitemaps by approved keywords; robots/license snapshots saved. Required action: check-source-policy."
      }
    },
    {
      "asset_id": "external.blog_webpage_visuals.uxwing.content_layout_view_icon_svg",
      "asset_class": "icon",
      "source_type": "external_registry_reference",
      "source_path": null,
      "license": "free-with-restrictions",
      "license_action": "check-source-policy",
      "risk_level": "medium",
      "production_eligible": true,
      "allowed_for_ppt": true,
      "style_tags": [
        "external_registry",
        "blog_webpage_visuals",
        "icon",
        "uxwing"
      ],
      "recommended_use": "external registry reference for future PPT materialization",
      "kind": "icon_svg",
      "external_asset_uid": "sha256:256ac291ab482be772a02c2e2fb49663bd631ea20e29bbef73a0897b21fd58ee:4ef2a48965dd",
      "external_set_id": "blog-webpage-visuals",
      "external_source_name": "UXWing",
      "external_asset_name": "content-layout-view-icon.svg",
      "external_relative_path": "icons\\uxwing-selected\\content-layout-view-icon.svg",
      "policy_notes": {
        "status": "active",
        "brand_guidelines_required": false,
        "attribution_required": false,
        "notes_for_ai": "Use as visual material for documents, reports, decks, blogs, and webpages. Do not treat as a redistributable open-source icon package. Additional selected SVG from saved public UXWing image sitemaps; matched terms: content;layout;web. Required action: check-source-policy."
      }
    },
    {
      "asset_id": "external.blog_webpage_visuals.uxwing.dashboard_monitoring_icon_svg",
      "asset_class": "icon",
      "source_type": "external_registry_reference",
      "source_path": null,
      "license": "free-with-restrictions",
      "license_action": "check-source-policy",
      "risk_level": "medium",
      "production_eligible": true,
      "allowed_for_ppt": true,
      "style_tags": [
        "external_registry",
        "blog_webpage_visuals",
        "icon",
        "uxwing"
      ],